{
  "schemaVersion": "0.4.7",
  "id": "van-hanh",
  "name": "Vận hành",
  "rows": [
    {
      "tag": "TANK01.SP",
      "decimals": 1,
      "writeValue": "75"
    },
    {
      "tag": "PUMP01.STATE",
      "format": "dec"
    },
    {
      "tag": "PUMP01.RUN_CMD",
      "format": "bool",
      "writeValue": "true"
    }
  ]
}
